{
  "$schema": "http://json-schema.org/draft-07/schema#",
  "title": "AlbanianEditorTrainingExample",
  "version": "1.0.0",
  "description": "Canonical schema for all training examples. Do not modify without bumping version.",
  "type": "object",
  "required": ["id", "metadata", "input", "output"],
  "properties": {
    "id": { "type": "string", "pattern": "^alb-[a-z]+-[0-9]{4}$" },
    "metadata": {
      "type": "object",
      "required": ["register", "annotator", "rlhf_eligible", "version"],
      "properties": {
        "register":       { "type": "string", "enum": ["editorial","informational","marketing","classical","mixed"] },
        "annotator":      { "type": "string", "enum": ["human","synthetic","human_corrected_synthetic"] },
        "rlhf_eligible":  { "type": "boolean" },
        "version":        { "type": "string" },
        "reviewer":       { "type": "string" },
        "reviewed_at":    { "type": "string", "format": "date" }
      }
    },
    "input": {
      "type": "object",
      "required": ["article_text"],
      "properties": {
        "brand_guidelines": { "type": "string", "description": "Client brand voice doc, injected at inference. Empty string if none." },
        "key_points":       { "type": "array", "items": { "type": "string" }, "description": "Original brief key points given to writer. Empty array if no brief was provided." },
        "article_text":     { "type": "string", "minLength": 100 }
      }
    },
    "output": {
      "type": "object",
      "required": ["grammar","writing_style","formatting","brand_compliance","marketing_compliance","structure"],
      "properties": {
        "grammar":             { "$ref": "#/definitions/guidanceTask" },
        "writing_style":       { "$ref": "#/definitions/styleTask" },
        "formatting":          { "$ref": "#/definitions/guidanceTask" },
        "brand_compliance":    { "$ref": "#/definitions/scoredTask" },
        "marketing_compliance":{ "$ref": "#/definitions/scoredTask" },
        "structure":           { "$ref": "#/definitions/structureTask" }
      }
    }
  },
  "definitions": {
    "issue": {
      "type": "object",
      "required": ["location","issue_type","guidance","severity"],
      "properties": {
        "location":   { "type": "string" },
        "issue_type": { "type": "string" },
        "guidance":   { "type": "string", "description": "MUST be instructional only — never rewrite the text, only tell the writer what kind of problem exists and where to look." },
        "severity":   { "type": "string", "enum": ["critical","major","minor"] }
      }
    },
    "guidanceTask": {
      "type": "object",
      "required": ["verdict","issues"],
      "properties": {
        "verdict": { "type": "string", "enum": ["pass","fail","partial"] },
        "issues":  { "type": "array", "items": { "$ref": "#/definitions/issue" } }
      }
    },
    "styleTask": {
      "allOf": [
        { "$ref": "#/definitions/guidanceTask" },
        {
          "properties": {
            "detected_register": { "type": "string", "enum": ["editorial","informational","marketing","classical","mixed"] },
            "expected_register": { "type": "string", "enum": ["editorial","informational","marketing","classical","mixed","unspecified"] }
          }
        }
      ]
    },
    "scoredTask": {
      "type": "object",
      "required": ["score","verdict","issues"],
      "properties": {
        "score":   { "type": "number", "minimum": 0, "maximum": 100 },
        "verdict": { "type": "string", "enum": ["pass","fail","partial"] },
        "issues":  { "type": "array", "items": { "$ref": "#/definitions/issue" } }
      }
    },
    "keyPointCoverage": {
      "type": "object",
      "required": ["key_point","covered","elaboration_quality"],
      "properties": {
        "key_point":           { "type": "string" },
        "covered":             { "type": "boolean" },
        "elaboration_quality": { "type": "string", "enum": ["thorough","adequate","shallow","missing"] }
      }
    },
    "structureTask": {
      "type": "object",
      "required": ["verdict","key_points_coverage","structure_type_detected","guidance"],
      "properties": {
        "verdict":               { "type": "string", "enum": ["pass","fail","partial","no_brief_provided"] },
        "key_points_coverage":   { "type": "array", "items": { "$ref": "#/definitions/keyPointCoverage" } },
        "structure_type_detected":{ "type": "string", "enum": ["linear","exponential","non-linear","unclear"] },
        "guidance":              { "type": "string" }
      }
    }
  }
}
