{
  "id": "alb-editorial-0006",
  "metadata": {
    "register": "editorial",
    "annotator": "human",
    "rlhf_eligible": true,
    "version": "1.0.0",
    "reviewer": "",
    "reviewed_at": ""
  },
  "input": {
    "brand_guidelines": "",
    "key_points": [],
    "article_text": "Certifikimet e industrisë: Pse një diplomë shkolle nuk mjafton pa njohjen e standardeve ndërkombëtare? Në një treg pune që ndryshon me shpejtësi, një diplomë shkolle nuk është më bileta e vetme drejt suksesit. Ajo mbetet e rëndësishme, sepse përfaqëson bazën teorike dhe përkushtimin disa- vjeçar ndaj një fushe studimi, por sot, vetëm teoria nuk mjafton. Industria kërkon prova konkrete të aftësive dhe këtu hyjnë në lojë certifikimet ndërkombëtare. Shumë studentë mendojnë se mjafton të përfundojnë universitetin për të qenë të përgatitur për tregun e punës. Në realitet, kompanitë kërkojnë kandidatë që jo vetëm e kuptojnë teorinë, por edhe dinë ta zbatojnë atë sipas standardeve globale. Një diplomë tregon çfarë ke studiuar, ndërsa një certifikim tregon çfarë di të bësh. Certifikimet e industrisë janë të ndërtuara mbi kërkesa reale të tregut. Ato përditësohen vazhdimisht për të reflektuar teknologjitë dhe praktikat më të fundit. Për shembull, në fushën e teknologjisë së informacionit, certifikime si Cisco, Microsoft apo CompTIA janë të njohura globalisht dhe shpesh kërkohen drejtpërdrejt në aplikimet për një pozicion pune. Një kandidat që zotëron këto certifikime jep një sinjal të qartë: ai/ ajo është testuar sipas standardeve ndërkombëtare. Njohja e standardeve globale sjell edhe një tjetër avantazh të rëndësishëm: lëvizshmërinë. Nëse një profesionist dëshiron të punojë jashtë vendit ose në kompani ndërkombëtare, certifikimet e njohura globalisht e bëjnë më të lehtë këtë tranzicion. Diploma mund të njihet ose jo nga një shtet tjetër, por një certifikim ndërkombëtar shpesh ka vlerë universale. Megjithatë, kjo nuk do të thotë se diploma është e pavlerë. Përkundrazi, ajo është themeli, por mbi këtë themel duhet ndërtuar vazhdimisht. Industria nuk pret për akënd, sepse është gjatë gjithë kohës në zhvillim. Standardet përditësohen, teknologjitë ndryshojnë dhe kërkesat rriten. Një profesionist që nuk investon në përditësimin e njohurive të tij rrezikon të mbetet pas. Suksesi profesional sot kërkon një kombinim të arsimit të përgjithshëm, të certifikimeve të industrisë dhe të përvojës praktike. Diploma hap derën, por certifikimet e mbajnë atë të hapur. Në një botë ku konkurenca është globale, njohja e standardeve ndërkombëtare nuk është luks, por është domosdoshmëri."
  },
  "output": {
    "grammar": {
      "verdict": "partial",
      "issues": []
    },
    "writing_style": {
      "verdict": "partial",
      "issues": [],
      "detected_register": "editorial",
      "expected_register": "unspecified"
    },
    "formatting": {
      "verdict": "pass",
      "issues": []
    },
    "brand_compliance": {
      "score": 50,
      "verdict": "partial",
      "issues": []
    },
    "marketing_compliance": {
      "score": 50,
      "verdict": "partial",
      "issues": []
    },
    "structure": {
      "verdict": "no_brief_provided",
      "key_points_coverage": [],
      "structure_type_detected": "unclear",
      "guidance": "No brief was provided, so structure assessment should focus on coherence and flow."
    }
  }
}
