{
  "id": "alb-informational-0054",
  "metadata": {
    "register": "informational",
    "annotator": "human",
    "rlhf_eligible": true,
    "version": "1.0.0",
    "reviewer": "",
    "reviewed_at": ""
  },
  "input": {
    "brand_guidelines": "",
    "key_points": [],
    "article_text": "Muzeu teknologjik i \"Harry Fultz\" Në mjediset e shkollës sonë është krijuar një hapësirë e veçantë dedikuar inovacionit. “Muzeu Teknologjik” është i vendosur në mjediset e ofiçinës dhe është ndërtuar mbi bazën e projekteve mësimore dhe kërkimore të nxënësve të degës profesionale Elektronikë-IT. Brenda tij paraqiten punime,që përfshijnë robotë autonomë, sisteme të zgjuara dhe pajisje elektronike që reflektojnë talentin dhe pasionin e tyre për teknologjinë. Realizimi i këtij muzeu është bërë i mundur falë angazhimit dhe përkushtimit të nxënësve, të cilët kanë punuar në mënyrë të vazhdueshme për ndërtimin dhe përmirësimin e projekteve të tyre. Krahas tyre, një rol kyç kanë pasur edhe profesorët mbikëqyrës, të cilët kanë udhëhequr procesin nga ana profesionale, kanë orientuar nxënësit nga ana teknike dhe kanë ndihmuar në zgjidhjen e problematikave gjatë realizimit të projekteve. Bashkëpunimi mes nxënësve dhe profesorëve ka qenë thelbësor për krijimin e muzeut. Një veçori e rëndësishme e Muzeut Teknologjik është karakteri i tij dinamik. Ekspozita nuk është e përhershme, por do të ndryshojë dhe pasurohet çdo vit me projekte të reja. Çdo brez nxënësish do të ketë mundësinë të kontribuojë me punimet e veta, duke sjellë pajisje dhe risi më të avancuara teknologjike. Kjo e bën muzeun një hapësirë gjithmonë në zhvillim dhe të lidhur me ecurinë e vazhdueshme të teknologjisë. Muzeu shërben gjithashtu si një mjet informues dhe orientues për nxënësit e tjerë të shkollës, veçanërisht për ata që interesohen për fushat teknike dhe teknologjike. Ai ofron një pasqyrë konkrete të punës që realizohet në drejtimin Elektronikë–IT dhe ndihmon në nxitjen e interesit për këto profile studimi. Ky muze përbën një nismë të rëndësishme që lidh arsimin teorik me praktikën teknologjike. Ai është një dëshmi e punës së përbashkët të nxënësve, si dhe një hapësirë që do të vazhdojë të zhvillohet vit pas viti. Ky muze pasuron jetën shkollore dhe përfaqëson një vlerë të shtuar për komunitetin e shkollës sonë."
  },
  "output": {
    "grammar": {
      "verdict": "partial",
      "issues": []
    },
    "writing_style": {
      "verdict": "partial",
      "issues": [],
      "detected_register": "informational",
      "expected_register": "unspecified"
    },
    "formatting": {
      "verdict": "pass",
      "issues": []
    },
    "brand_compliance": {
      "score": 50,
      "verdict": "partial",
      "issues": []
    },
    "marketing_compliance": {
      "score": 50,
      "verdict": "partial",
      "issues": []
    },
    "structure": {
      "verdict": "no_brief_provided",
      "key_points_coverage": [],
      "structure_type_detected": "unclear",
      "guidance": "No brief was provided, so structure assessment should focus on coherence and flow."
    }
  }
}
