{
  "id": "alb-informational-0031",
  "metadata": {
    "register": "informational",
    "annotator": "human",
    "rlhf_eligible": true,
    "version": "1.0.0",
    "reviewer": "",
    "reviewed_at": ""
  },
  "input": {
    "brand_guidelines": "",
    "key_points": [],
    "article_text": "Delegacioni i \"Harry Fultz\" Shpallet më i Suksesshmi në HTF MUN Në një mjedis ku diplomacia, mendimi kritik dhe aftësitë argumentuese testohen nën presionin e debateve ndërkombëtare, nxënësit e Institutit \"Harry Fultz\" kanë dëshmuar edhe një herë se janë liderët e së nesërmes. Këtë fundjavë, në mjediset e shkollës \"Sami Frashëri\", u zhvillua simulimi i Kombeve të Bashkuara (Model United Nations – MUN), ku delegacioni ynë jo vetëm që u përfaqësua me dinjitet, por doli si grupi më i suksesshëm i veprimtarisë. Nga 15 nxënës që përfaqësuan shkollën tonë, pesë prej tyre arritën rezultate të dalluara, duke u vlerësuar për saktësinë akademike dhe forcën e oratorisë. Ky sukses është produkt i një profili arsimor që në \"Harry Fultz\" integron shkencat sociale me praktikën e debatit dhe kërkimit shkencor. Debati në formatin MUN kërkon një njohje të thellë të gjeopolitikës, ekonomisë dhe të drejtave të njeriut. Tre nga nxënësit tanë arritën të shpallen \"Debatues të Dalluar\" (Outstanding Debaters), duke dominuar në komitetet e tyre respektive: Nicolas Mata, Oresti Zhilli, Sara Tereziu. Këta nxënës demonstruan një aftësi të rrallë për të hartuar rezoluta dhe për të mbrojtur interesat e vendeve që përfaqësonin me një logjikë të pathyeshme. Nga ana tjetër, suksesi u shtri edhe në prapavijën e rëndësishme intelektuale të veprimtarisë. Rea Hylli dhe Irsa Nakuçi ishin pjesë kyçe e Skuadrës Akademike, një pozicion që kërkon përgatitje të lartë në kërkimin e fakteve dhe menaxhimin e rregulloreve të debatit. Përtej çmimeve dhe certifikatave, kjo përvojë shërbeu për të forcuar frymën e grupit. Bashkëpunimi mes 15 delegatëve tanë tregoi se suksesi individual te \"Harry Fultz\" është gjithmonë i mbështetur në një rrjet solid mbështetjeje reciproke. Ata ndihmuan njëri-tjetrin në kërkimin e materialeve, në përgatitjen e fjalimeve dhe në strategjitë e lobimit, duke krijuar kujtime të paharrueshme që shkojnë përtej një fundjave shkollore. Ky triumf në HTFMUN është një tjetër fakt që vërteton se nxënësit tanë janë të pajisur me mjetet e duhura për të sfiduar çdo kriter ndërkombëtar. Ata nuk po mësojnë thjesht për botën por ata po trajnohen për ta drejtuar atë."
  },
  "output": {
    "grammar": {
      "verdict": "partial",
      "issues": []
    },
    "writing_style": {
      "verdict": "partial",
      "issues": [],
      "detected_register": "informational",
      "expected_register": "unspecified"
    },
    "formatting": {
      "verdict": "pass",
      "issues": []
    },
    "brand_compliance": {
      "score": 50,
      "verdict": "partial",
      "issues": []
    },
    "marketing_compliance": {
      "score": 50,
      "verdict": "partial",
      "issues": []
    },
    "structure": {
      "verdict": "no_brief_provided",
      "key_points_coverage": [],
      "structure_type_detected": "unclear",
      "guidance": "No brief was provided, so structure assessment should focus on coherence and flow."
    }
  }
}
