{
  "id": "alb-editorial-0007",
  "metadata": {
    "register": "editorial",
    "annotator": "human",
    "rlhf_eligible": true,
    "version": "1.0.0",
    "reviewer": "",
    "reviewed_at": ""
  },
  "input": {
    "brand_guidelines": "",
    "key_points": [],
    "article_text": "BSc apo BEng: Cila është zgjedhja më e mirë për nxënësit? Zgjedhja midis një Bachelor-i të Shkencave (BSc) dhe një Bachelor-i të Inxhinierisë (BEng) mund të duket e vështirë. Të dyja janë diploma të avancuara. Të dyja hapin rrugën drejt një karriere të qëndrueshme dhe të dyja tingëllojnë mbresëlënëse kur të tjerët ju pyesin se çfarë po studioni. Por nuk janë të njëjta gjë. Një BSc në përgjithësi është më i fokusuar në teori. Ai ka baza të forta te matematikes, parimeve shkencore, metodave te kerkimit dhe thellesise analitike. Programe si matematika, fizika, shkencat kompjuterike dhe statistika shpesh ofrohen si diploma BSc. Kjo rrugë i përshtatet studentëve që shijojnë të menduarit abstrakt, zgjidhjen e problemeve dhe ndoshta vazhdimin e një masteri ose doktorature. Një BEng është më i orientuar drejt aplikimit. Ai përqendrohet në projektimin, ndërtimin dhe zbatimin e sistemeve të botës reale. Studentët kryejnë punë laboratorike, projekte kreative dhe ndonjëherë edhe aplikim industrial. Kjo diplomë është ideale për ata që duan të punojnë drejtpërdrejt në industri inxhinierike si inxhinieria civile, mekanike, elektrike ose softuerike. Por si të vendosni për njerën prej diplomave? Le t'u përgjigjemi pyetjeve kryesore që studentët duhet t'i bëjnë vetes: 1. A ju pëlqen më shumë teoria abstrakte apo zbatimi praktik? Nëse ju pëlqejnë provat e thella matematikore, modelet dhe të kuptuarit se si funksionojnë gjërat në një nivel themelor, një BSc mund t'ju përshtatet më mirë. Nëse preferoni ndërtimin, projektimin, testimin dhe zgjidhjen e problemeve praktike të botës reale, një BEng mund të jetë zgjedhja më e mirë. 2. A po mendoni për kërkime pasuniversitare? Nëse e shihni veten duke ndjekur një master ose doktoraturë, veçanërisht në fusha të gjera kërkimore, një BSc shpesh ofron një bazë teorike pak më të fortë. Megjithatë, shumë të diplomuar në BEng gjithashtu vazhdojnë me sukses studimet pasuniversitare. 3. A dëshironi akreditim profesional në inxhinieri? Në shumë vende, një BEng është strukturuar posaçërisht për të përmbushur kërkesat e akreditimit për t'u bërë një inxhinier i licencuar. Një BSc në një fushë të lidhur me inxhinierinë mund të kërkojë kualifikime shtesë pasuniversitare për të arritur të njëjtin status profesional. Nëse qëllimi juaj është të bëheni një inxhinier i çertifikuar, BEng mund të ofrojë një rrugë më të drejtpërdrejtë. 4. Si janë tregjet e punës në vendin tuaj? Në disa rajone, punëdhënësit i trajtojnë BSc dhe BEng pothuajse në mënyrë të barabartë. Në të tjera, dallimi ka më shumë rëndësi. Nëse industritë lokale i japin përparësi diplomave të akredituara të inxhinierisë, BEng mund të ofrojë një avantazh konkurrues. Nëse synoni karriera në shkencën e të dhënave, financë, konsulencë ose kërkim, një BSc mund të jetë po aq i fuqishëm. Për ta përmbledhur, nuk ka një diplomë universale \"më të mirë\". Zgjedhja më e mirë varet nga pikat tuaja të forta, ambiciet dhe stili i preferuar i të nxënit. Në realitet, punëdhënësit kujdesen më shumë për aftësitë, stazhet, projektet dhe performancën tuaj sesa për shkronjat e sakta në diplomën tuaj. Një student i motivuar me përvojë do të dallohet gjithmonë më shumë sesa dikush që mbështetet vetëm në titullin e diplomës së tij. Vendimi më i zgjuar nuk është të zgjidhni atë që tingëllon më interesant. Është të zgjidhni rrugën që ju përshtatet dhe pastaj t'i përkushtoheni plotësisht asaj."
  },
  "output": {
    "grammar": {
      "verdict": "partial",
      "issues": []
    },
    "writing_style": {
      "verdict": "partial",
      "issues": [],
      "detected_register": "editorial",
      "expected_register": "unspecified"
    },
    "formatting": {
      "verdict": "pass",
      "issues": []
    },
    "brand_compliance": {
      "score": 50,
      "verdict": "partial",
      "issues": []
    },
    "marketing_compliance": {
      "score": 50,
      "verdict": "partial",
      "issues": []
    },
    "structure": {
      "verdict": "no_brief_provided",
      "key_points_coverage": [],
      "structure_type_detected": "unclear",
      "guidance": "No brief was provided, so structure assessment should focus on coherence and flow."
    }
  }
}
