{
  "id": "alb-marketing-0058",
  "metadata": {
    "register": "marketing",
    "annotator": "human",
    "rlhf_eligible": true,
    "version": "1.0.0",
    "reviewer": "",
    "reviewed_at": ""
  },
  "input": {
    "brand_guidelines": "",
    "key_points": [],
    "article_text": "Inovacioni në Lëvizje: “Festivali i Shkencës 2026” Në Institutin \"Harry Fultz\", aty ku muret dëshmojnë një traditë mbi 100-vjeçare të edukimit teknik, energjia e inovacionit aktualisht gjendet në kulmin e saj. Ky vit shënon një gur themeli të ri me organizimin e \"Festivalit të Shkencës 2026\", një veprimtari që po shpaloset si një manifestim i gjallë i bashkëpunimit ndërdisiplinor dhe mendimit kritik. Për momentin, laboratorët dhe klasat tona janë shndërruar në qendra kërkimore të ethshme. Atmosfera është unike; nxënësit e elektronikës dhe robotikës janë të zhytur në skemat e tyre, duke bashkuar forcat me nxënësit e degëve të tjera për të zgjidhur sfidat komplekse të projekteve. Ky ndërveprim bazohet në parimin e sinergjisë inxhinierike: koncepti ku vlera e kombinuar e dy fushave të ndryshme prodhon një zgjidhje që asnjëra nuk do ta arrinte dot e vetme. Aktualisht, projektet po kalojnë nga faza e skicave teorike drejt prototipeve funksionale. Ky është momenti më kritik i zhvillimit, ku nxënësit mësojnë të jenë arkitektë të teknologjisë dhe jo thjesht konsumatorë. Menaxhimi i kohës, ndarja e përgjegjësive dhe zgjidhja e problemeve në kohë reale (troubleshooting) po ndërtojnë karakterin e një brezi që guxon të krijojë nën presion. Edhe pse dita finale e prezantimit po afrohet, puna që po bëhet në këto momente është ajo që përcakton suksesin. Jemi dëshmitarë të krijimit të sistemeve të automatizuara të energjisë dhe aplikacioneve inovative për menaxhimin e të dhënave që synojnë zgjidhjen e problemeve reale. Çdo stendë që po përgatitet është një histori përkushtimi në zhvillim e sipër. Përgatitjet nuk kufizohen vetëm në anën teknike. Nxënësit po rafinojnë aftësitë e tyre prezantuese, duke u ushtruar për mbrojtjen e argumentit shkencor dhe demonstrimin e prototipeve përpara jurisë. Kjo \"provë gjenerale\" po shërben si një urë lidhëse drejt sfidave që i presin në universitetet ndërkombëtare dhe industrinë globale. Etheve të garës u shtohet entuziazmi i pritjes. Megjithëse fituesit nuk janë shpallur ende, konsolidimi i ndjenjës së përkatësisë dhe etika e punës në grup janë fitoret tona të para. \"Festivali i Shkencës 2026\" po dëshmon se kur bashkëpunimi dhe angazhimi bëhen njësh, shkenca bëhet mjeti më i fuqishëm për të ndërtuar të ardhmen."
  },
  "output": {
    "grammar": {
      "verdict": "partial",
      "issues": []
    },
    "writing_style": {
      "verdict": "partial",
      "issues": [],
      "detected_register": "marketing",
      "expected_register": "unspecified"
    },
    "formatting": {
      "verdict": "pass",
      "issues": []
    },
    "brand_compliance": {
      "score": 50,
      "verdict": "partial",
      "issues": []
    },
    "marketing_compliance": {
      "score": 50,
      "verdict": "partial",
      "issues": []
    },
    "structure": {
      "verdict": "no_brief_provided",
      "key_points_coverage": [],
      "structure_type_detected": "unclear",
      "guidance": "No brief was provided, so structure assessment should focus on coherence and flow."
    }
  }
}
