{
  "id": "alb-marketing-0057",
  "metadata": {
    "register": "marketing",
    "annotator": "human",
    "rlhf_eligible": true,
    "version": "1.0.0",
    "reviewer": "",
    "reviewed_at": ""
  },
  "input": {
    "brand_guidelines": "",
    "key_points": [],
    "article_text": "Klubet e \"Harry Fultz\" Një pjesë shumë e rëndësishme e shkollës sonë janë klubet, ku çdo nxënës gjen mundësinë të zhvillojë ose të shpalosë talentet e tij. Ato fillojnë të organizohen zakonisht një deri në dy muaj pas fillimit të vitit shkollor dhe funksionojnë përgjatë të gjithë vitit. Nxënësit mund të informohen rreth klubeve nga mësuesit përkatës që i drejtojnë ato, mund të spikaten prej tyre për aftësitë që tregojnë në fushën përkatëse, ose mund të interesohen vetë për klube specifike dhe të kërkojnë të bëhen pjesë e tyre. Secili klub organizon evente të ndryshme dhe takime të shpeshta, që shtrihen në hapësirën kohore përgjatë muajve pas hapjes së klubit. Veprimtaria më e fundit ishte ajo e Klubit të Historisë, i cili organizoi një vizitë në Shtëpinë e Gjetheve më 17 tetor. Dashamirësit e historisë patën mundësinë të eksploronin dhomat e ndryshme të kësaj ndërtese historike dhe të mësonin domethënien e secilës prej tyre. Një klub tjetër shumë i njohur është Klubi i Debatit, ku nxënësit zhvillojnë aftësitë e tyre të arsyetimit dhe të të folurit në publik. Kur afrohet konkursi i përvitshëm, ata përballen me nxënës të shkollave të tjera të Shqipërisë, si edhe zhvillojnë veprimtari jashtë saj. Instituti \"Harry Fultz\" ka një nga klubet më të zhvilluara dhe të arrira të debatit, duke fituar çmime të shumta ndër vite, jo vetëm në Shqipëri por edhe jashtë saj. Nëse debati nuk është për ju dhe ëndërroni ta zotëroni skenën e ta rrëmbeni publikun në një mënyrë më krijuese, atëherë Klubi i Teatrit është ideal për ju! Shfaqja e teatrit në \"Harry Fultz\" është një event i shumëpritur, në të cilin kurrë nuk mungojnë historitë tërheqëse dhe nxënësit që i sjellin personazhet në jetë duke i dhënë jo vetëm fjalë por edhe jetë, dhe sigurisht, nuk mungon kurrë publiku, e cila e ndjek produktin mbreslënës të punës së tyre me kënaqësinë më të madhe. Klubet e historisë, debatit dhe teatrit nuk janë të vetmit në departamentin e lëndëve shoqërore. Atyre u bashkohen edhe Klubi i Gjeografisë, Klubi i Gjermanishtes, si edhe Klubi i Leximit “Miqtë e Librit”, ku trajtohet ajka e letërsisë nga nxënësit e apasionuar pas saj. Nuk mund të harrojmë as klubet e shkencave, si ai i Fizikës dhe Klubi i Kimisë. Në këtë të fundit, nxënësit mësojnë si të krijojnë reaksione kimike, cilat janë mjetet e nevojshme për përzierjen e substancave dhe çfarë produktesh përftohen. Klubi i Kimisë është ideal për ata që ëndërrojnë të punojnë në laboratorë në një të ardhme të afërt. Po ashtu, klubi i ekologjisë është i përsosur për dashamirësit e shkencave natyrore dhe mjedisit. Aty ku bashkohet kreativiteti me shkencën gjendet dhe klubi i matematikës, i cili së fundmi është duke krijuar një libër komik që i vesh historive fantastike rregullat dhe ligjet e matematikës në një udhëtim që jemi të lumtur ta ndjekim. Nëse klubet dëshironi t’i frekuentoni për t’u shkëputur pak nga mësimet, mund t’i bashkoheni klubeve sporteve, si ai i basketbollit, futbollit dhe volejbollit. Çdo vit, këto klube zhvillojnë ndeshje të ndryshme me shkolla të Tiranës, duke nxitur shpirtin e skuadrës dhe të sportit. Stërvitja mendore është po aq e rëndësishme sa ajo fizike. Pikërisht këtu hyn në lojë Klubi i Shahut, i cili çdo vit organizon një veprimtari ku nxënës nga të gjitha vitet kanë mundësinë të konkurrojnë me njëri-tjetrin për vendin fitues, duke shfaqur aftësitë e tyre strategjike. Nuk mund të përmendim Institutin \"Harry Fultz\" pa përmendur edhe klubet profesionale, si Klubi i Automekanikës, Klubi i Biznesit dhe klubet e elektronikës, robotikës, IT-së e kodimit dhe telekomunikacionit, ku nxënësit zhvillojnë aftësitë e tyre teknologjike. Në klubin e robotikës bashkëpunimi mes brezave është thelbësor. Vitet e treta shërbejnë si udhërrëfyes për vitet e dyta, duke i mësuar atyre hapat e nevojshëm për krijimin e një projekti. Ata ndahen në grupe sipas fushës së tyre: Dizenjuesit, Programuesit dhe Teknikët. Para se të nisin ndërtimet, nxënësit kryejnë një hulumtim të detajuar mbi mënyrën e realizimit të projektit dhe përcaktojnë materialet që do t’u nevojiten gjatë procesit. Gjatë gjithë kësaj kohe, vitet e treta luajnë rolin e trajnerëve, duke i udhëzuar dhe ndihmuar nxënësit e vitit të dytë të fitojnë përvojë praktike dhe të përvetësojnë punën në grup për të kryer projekte. Çdo vit i tretë ka nën mbikëqyrje një vit të dytë, duke siguruar që bashkëpunimi të jetë sa më efektiv. Së fundmi, vjen Klubi i Multimedias, i cili shoqëron çdo veprimtari që ndodh gjatë gjithë vitit shkollor, duke dokumentuar momentet më të rëndësishme dhe duke ruajtur kujtimet më të bukura të shkollës. Pra, nëse pasditet tuaja janë bosh, ose nëse dëshironi të provoni diçka të re, ku mund të zhvilloni aftësi të reja dhe të zgjeroni rrethin tuaj shoqëror, klubet janë vendi ideal për të filluar!"
  },
  "output": {
    "grammar": {
      "verdict": "partial",
      "issues": []
    },
    "writing_style": {
      "verdict": "partial",
      "issues": [],
      "detected_register": "marketing",
      "expected_register": "unspecified"
    },
    "formatting": {
      "verdict": "pass",
      "issues": []
    },
    "brand_compliance": {
      "score": 50,
      "verdict": "partial",
      "issues": []
    },
    "marketing_compliance": {
      "score": 50,
      "verdict": "partial",
      "issues": []
    },
    "structure": {
      "verdict": "no_brief_provided",
      "key_points_coverage": [],
      "structure_type_detected": "unclear",
      "guidance": "No brief was provided, so structure assessment should focus on coherence and flow."
    }
  }
}
