{
  "id": "alb-informational-0026",
  "metadata": {
    "register": "informational",
    "annotator": "human",
    "rlhf_eligible": true,
    "version": "1.0.0",
    "reviewer": "",
    "reviewed_at": ""
  },
  "input": {
    "brand_guidelines": "",
    "key_points": [],
    "article_text": "Kuriozitete Zemra e njeriut pompon rreth 2,000 litra gjak në ditë. Truri i njeriut përmban mbi 100 miliardë neurone. Gjuhët në botë janë mbi 7,000, por gjysma e tyre fliten nga më pak se 10,000 njerëz secila. Në hapësirë nuk ka zë sepse nuk ka ajër për të përhapur valët e zërit. Qentë mund të nuhasin sëmundje si kanceri dhe diabeti. Bletët kanë pesë sy. Në Finlandë ka më shumë sauna se makina. Australia është më e gjerë se Hëna. Pinguinët nuk jetojnë në Polin e Veriut, por vetëm në Polin e Jugut. Njerëzit dhe bananet ndajnë rreth 60% të ADN-së. Një njeri kalon rreth një të tretën e jetës duke fjetur. Disa lloje peshqish mund të ecin përkohësisht në tokë. Uji mund të vlojë dhe të ngrijë njëkohësisht në kushte të caktuara presioni. Trupi i njeriut përmban mjaftueshëm hekur për të bërë një gozhdë të vogël. Elektriciteti lëviz nëpër trup me një shpejtësi mbi 100 metra për sekondë. Në Antarktidë ka më shumë pinguinë se njerëz. Pulëbardhat mund të pinë ujë deti dhe ta nxjerrin kripën jashtë përmes gjendrave të veçanta. Shumë njerëz kanë frikë nga numri 13, dhe kjo quhet triskaidekafobi. Krokodilët nuk mund të nxjerrin gjuhën jashtë gojës. Fluturat ndiejnë shijen me këmbët e tyre."
  },
  "output": {
    "grammar": {
      "verdict": "partial",
      "issues": []
    },
    "writing_style": {
      "verdict": "partial",
      "issues": [],
      "detected_register": "informational",
      "expected_register": "unspecified"
    },
    "formatting": {
      "verdict": "pass",
      "issues": []
    },
    "brand_compliance": {
      "score": 50,
      "verdict": "partial",
      "issues": []
    },
    "marketing_compliance": {
      "score": 50,
      "verdict": "partial",
      "issues": []
    },
    "structure": {
      "verdict": "no_brief_provided",
      "key_points_coverage": [],
      "structure_type_detected": "unclear",
      "guidance": "No brief was provided, so structure assessment should focus on coherence and flow."
    }
  }
}
