{
  "id": "alb-informational-0024",
  "metadata": {
    "register": "informational",
    "annotator": "human",
    "rlhf_eligible": true,
    "version": "1.0.0",
    "reviewer": "",
    "reviewed_at": ""
  },
  "input": {
    "brand_guidelines": "",
    "key_points": [],
    "article_text": "Vizitë studimore në kompanitë “InfoSoft” dhe “Algrafika” Praktika mësimore, është një nga lëndët që na përfshin të gjithëve me pasion. Duket se padurimi për t'i vënë në jetë ato njohuri teorike që marrim ndër libra, gjen shteg për t'u shprehur më në fund. Më datë 15 tetor, nxënësit e vitit të katërt të degës Biznes, në kuadër të lëndës “Praktikë Mësimore”, realizuan një vizitë studimore në kompanitë InfoSoft dhe Algrafika, ku u njohën nga afër me proceset e rekrutimit, kontraktimit dhe organizimit të punës në këto ndërmarrje. InfoSoft Office është një ndër kompanitë lidere në Shqipëri dhe Kosovë në furnizimin me materiale kancelarie, produkte letre dhe materiale printimi nga markat më të njohura ndërkombëtare. Kompania u shërben një game të gjerë klientësh, duke filluar nga studentë, biznese private, institucione publike, organizata joqeveritare, deri te bankat, kompanitë e telekomunikacionit dhe trupat diplomatike. Gjatë vizitës, nxënësit, të shoqëruar nga mësuese Desdemona, patën mundësinë të njihnin nga afër jo vetëm mënyrën e prodhimit dhe shitjes së këtyre produkteve, por edhe procesin e përgatitjes së dokumentacionit financiar dhe administrativ që shoqëron çdo transaksion shitjeje. Një ndër momentet që la më shumë përshtypje ishte mënyra e punësimit të punonjësve. Kandidatët kalonin disa faza testimesh për t'u përzgjedhur, çka kërkon përgatitje, përkushtim dhe vullnet. Për nxënësit e interesuar, kompania ofroi mundësinë e intership-eve, me qëllim zhvillimin e aftësive profesionale dhe përgatitjen e tyre për tregun e punës, një mundësi e çmuar për formimin praktik dhe rritjen personale. Pas përfundimit të vizitës, nxënësit praktikuan njohuritë e fituara, veçanërisht ato që lidhen me dokumentacionin e biznesit, në praktikën që zhvillohet në shkollë."
  },
  "output": {
    "grammar": {
      "verdict": "partial",
      "issues": []
    },
    "writing_style": {
      "verdict": "partial",
      "issues": [],
      "detected_register": "informational",
      "expected_register": "unspecified"
    },
    "formatting": {
      "verdict": "pass",
      "issues": []
    },
    "brand_compliance": {
      "score": 50,
      "verdict": "partial",
      "issues": []
    },
    "marketing_compliance": {
      "score": 50,
      "verdict": "partial",
      "issues": []
    },
    "structure": {
      "verdict": "no_brief_provided",
      "key_points_coverage": [],
      "structure_type_detected": "unclear",
      "guidance": "No brief was provided, so structure assessment should focus on coherence and flow."
    }
  }
}
