{
  "id": "alb-classical-0064",
  "metadata": {
    "register": "classical",
    "annotator": "human",
    "rlhf_eligible": true,
    "version": "1.0.0",
    "reviewer": "",
    "reviewed_at": ""
  },
  "input": {
    "brand_guidelines": "",
    "key_points": [],
    "article_text": "The stars we dream upon They say stars collect dreams as they fall down. People go and put their wishes on these shooting stars. These stars are said to make your heart wishes come true. I wonder how it happens. Do hopes make things true? I say that the stars - the ones that burn so deep, are always the ones in where we believe. Although they are hurting and burning themselves, they still stay in the sky, quietly, looking at our tears. And when the pain they see every night, when it finally weighs them down, then they start falling from the high, thinking they can reach you, and can make you smile. So they fall down just like tears, and they burn the sky the way tears burn your skin, because that is all that they know best that is all they have seen in the endless darkness. And as a star shower you see, remember someone holds you dear. Someone up there in the sky, falls just for you to smile. Someone, or something. Whatever it is! Cries down with burning tears, and it collects all your dreams, giving you a view that sleep never can give. So I don't know if hope can make everything come true, but love and sacrifice sure will do."
  },
  "output": {
    "grammar": {
      "verdict": "partial",
      "issues": []
    },
    "writing_style": {
      "verdict": "partial",
      "issues": [],
      "detected_register": "classical",
      "expected_register": "unspecified"
    },
    "formatting": {
      "verdict": "pass",
      "issues": []
    },
    "brand_compliance": {
      "score": 50,
      "verdict": "partial",
      "issues": []
    },
    "marketing_compliance": {
      "score": 50,
      "verdict": "partial",
      "issues": []
    },
    "structure": {
      "verdict": "no_brief_provided",
      "key_points_coverage": [],
      "structure_type_detected": "unclear",
      "guidance": "No brief was provided, so structure assessment should focus on coherence and flow."
    }
  }
}
