{
  "id": "alb-informational-0023",
  "metadata": {
    "register": "informational",
    "annotator": "human",
    "rlhf_eligible": true,
    "version": "1.0.0",
    "reviewer": "",
    "reviewed_at": ""
  },
  "input": {
    "brand_guidelines": "",
    "key_points": [],
    "article_text": "Maratona e Sigurisë Kibernetike, Takimi me AKSK Nxënësit tanë, pjesëmarrës në Maratonën Kombëtare të Sigurisë Kibernetike, zhvilluan një takim frytdhënës me përfaqësues të Autoritetit Kombëtar për Sigurinë Kibernetike (AKSK). Gjatë takimit u diskutua mbi rëndësinë e mbrojtjes digjitale, sfidat e sigurisë në internet dhe mundësitë që kjo fushë ofron për të rinjtë. Maratona e Sigurisë Kibernetike është një garë kombëtare që synon të nxisë talentet e reja në teknologji, përmes sfidave praktike në fusha si kriptografia dhe mbrojtja e rrjeteve. Pjesëmarrja në këtë veprimtari ndihmon nxënësit të zhvillojnë aftësi teknike, punë në grup dhe mendim kritik. Falënderojmë AKSK për bashkëpunimin dhe mbështetjen në përgatitjen e brezit të ardhshëm të ekspertëve të sigurisë digjitale."
  },
  "output": {
    "grammar": {
      "verdict": "partial",
      "issues": []
    },
    "writing_style": {
      "verdict": "partial",
      "issues": [],
      "detected_register": "informational",
      "expected_register": "unspecified"
    },
    "formatting": {
      "verdict": "pass",
      "issues": []
    },
    "brand_compliance": {
      "score": 50,
      "verdict": "partial",
      "issues": []
    },
    "marketing_compliance": {
      "score": 50,
      "verdict": "partial",
      "issues": []
    },
    "structure": {
      "verdict": "no_brief_provided",
      "key_points_coverage": [],
      "structure_type_detected": "unclear",
      "guidance": "No brief was provided, so structure assessment should focus on coherence and flow."
    }
  }
}
