{
  "id": "alb-informational-0046",
  "metadata": {
    "register": "informational",
    "annotator": "human",
    "rlhf_eligible": true,
    "version": "1.0.0",
    "reviewer": "",
    "reviewed_at": ""
  },
  "input": {
    "brand_guidelines": "",
    "key_points": [],
    "article_text": "Vizitë Mësimore në KPGJT Në mjediset e Kolegji Profesional i Lartë Gjerman i Teknologjisë u zhvillua një vizitë mësimore dyditore nga nxënës maturantë të profilit automekanik të Instituti \"Harry Fultz\", në kuadër të sensibilizimit për arsimin profesional dhe orientimin në karrierë. Gjatë vizitës, nxënësit u njohën me programet mësimore që ofron KPGJT, strukturën e studimeve si dhe mundësitë e punësimit pas përfundimit të tyre. Një pjesë e rëndësishme e veprimtarisë ishte zhvillimi i një ore mësimore praktike, ku nxënësit patën mundësinë të punonin me simulatorë modernë dhe pajisje diagnostikuese elektronike, duke u njohur nga afër me teknologjitë bashkëkohore të automjeteve. Nxënësit, pasi u instruktuan mbi mënyrën e vënies në punë të simulatorittë motorit me naftë (sistemi CDI), kryen diagnostikimin me kompjuter diagnostikues Bosch KTS 570, ku u lexuan efektet dhe u diskutuan mundësitë e riparimit. Gjatë funksionimit të simulatorit, nxënësit panë në mënyrë reale në bangoprovë sistemin e ushqimit, procesin e injektimit në dhomën e djegies (nga injektorët në proveza, për sasinë dhe cilësinë e injektimit), si dhe rikthimin e karburantit nga injektorët. U simuluan disa defekte reale në simulator, të cilat u lexuan në ekranin e tij dhe paralelisht me kompjuterin diagnostikues. E njëjta procedurë u realizua edhe në simulatorin e motorit me benzinë. Në simulatorin e sistemit elektrik dhe audio u kryen testime me kompjuter diagnostikues dhe u simuluan disa defekte, ku nxënësit, duke u orientuar në skemën elektrike të simulatorit, realizuan matje me mjetet përkatëse si multimetri, indikatorët, etj. dhe kryen riparimin e defekteve. Gjithashtu, nxënësit punuar me simulatorin e sistemit të sigurisë SRS (Airbag), duke analizuar defektet, kontrollin dhe mundësitë e riparimit, si dhe me simulatorin e sistemit të frenimit ABS. Në simulatorin e sistemit të parangrohjes me kaldajë me lëndë djegëse dhe në sistemin e ftohjes me gaz R1234YF (gaz ekologjik), u krye diagnostikimi me kompjuter diagnostikues edhe gjatë punës në ngarkesë, duke lexuar parametrat e presionit dhe temperaturës, si dhe duke i monitoruar ato në kroskotin e simulatorit në mënyrë digjitale dhe analoge. Nxënësit u informuan për gazin e ri R1234YF, ndikimin e tij në mjedis, mënyrat e zëvendësimit dhe testimit të sistemit, si dhe për defektet dhe mundësitë e riparimit. Vizita vijoi në mjediset e zhvillimit të praktikës, ku nxënësit u njohën me automjete të ndryshme të pajisura me panele stimuluese, si dhe me pajisje dhe agregate të ndryshme, motorë, kambio manuale dhe automatike të mjeteve aktuale dhe sisteme të tjera, me të cilat realizohen punime praktike duke ndërthurur teorinë me praktikën profesionale. Veprimtaria vijoi edhe në mjediset e Autostar Albania, ku nxënësit vizituan të gjithë sektorët, duke filluar nga mënyra e pranimit të mjeteve në servis, deri te proceset mekanike, elektrike dhe elektronike që kryhen në automjete, si dhe sektorin e riparimit të kamionëve. Kjo vizitë shërbeu si një përvojë motivuese dhe informuese për nxënësit, duke nxitur interesin e tyre për zhvillimin profesional në fushën e automobilistikës."
  },
  "output": {
    "grammar": {
      "verdict": "partial",
      "issues": []
    },
    "writing_style": {
      "verdict": "partial",
      "issues": [],
      "detected_register": "informational",
      "expected_register": "unspecified"
    },
    "formatting": {
      "verdict": "pass",
      "issues": []
    },
    "brand_compliance": {
      "score": 50,
      "verdict": "partial",
      "issues": []
    },
    "marketing_compliance": {
      "score": 50,
      "verdict": "partial",
      "issues": []
    },
    "structure": {
      "verdict": "no_brief_provided",
      "key_points_coverage": [],
      "structure_type_detected": "unclear",
      "guidance": "No brief was provided, so structure assessment should focus on coherence and flow."
    }
  }
}
