{
  "id": "alb-informational-0048",
  "metadata": {
    "register": "informational",
    "annotator": "human",
    "rlhf_eligible": true,
    "version": "1.0.0",
    "reviewer": "",
    "reviewed_at": ""
  },
  "input": {
    "brand_guidelines": "",
    "key_points": [],
    "article_text": "Konkursi në lëndën e biologjisë Në shkollën tonë u zhvillua një konkurs biologjie mes klasave 1-4, 1-6, 1-6, 1-7 dhe 1-8, i cili solli një atmosferë entuziazmi, gare dhe bashkëpunimi mes nxënësve. Kjo veprimtari kishte për qëllim të nxiste interesin për shkencën, si dhe të vënë në provë njohuritë që nxënësit kanë përvetësuar gjatë dy tremujoreve në lëndën e biologjisë. Konkursi u organizua në një mënyrë moderne dhe bashkëvepruese nën mbikëqyrjen e mësuese Dhuratës përmes platformës Kahoot, e cila e bëri garën më dinamike dhe tërheqëse për të gjithë pjesëmarrësit. Në total, konkursi përmbante 40 pyetje që përfshinin tema të ndryshme nga programi mësimor i biologjisë, të trajtuara gjatë dy tremujoreve. Pyetjet kërkonin jo vetëm njohuri teorike, por edhe vëmendje, shpejtësi dhe shkathtësi nga nxënësit. Gjatë konkursit, nxënësit treguan përgatitje të mirë dhe pjesëmarrje të zjarrtë. Çdo klasë u përpoq të jepte më të mirën për të arritur rezultatin më të lartë, duke krijuar një garë të bukur dhe të ndershme mes tyre. Atmosfera ishte plot emocion, pasi pas çdo pyetjeje renditja ndryshonte dhe diferencat në pikë ishin shumë të vogla. Kjo veprimtari jo vetëm që ndihmoi në përforcimin e njohurive të biologjisë, por gjithashtu nxiti frymën e bashkëpunimit, konkurrencës së shëndetshme dhe të mësuarit përmes lojës. Nxënësit patën mundësinë të mësojnë dhe njëkohësisht të argëtohen, duke e bërë procesin e të nxënit më të këndshëm dhe motivues. Pas një gare të fortë dhe plot emocione deri në pyetjen e fundit, fituese u shpall klasa 1-5, e cila arriti të grumbullojë numrin më të madh të pikëve. Nxënësit e kësaj klase u dalluan për saktësinë dhe shpejtësinë në përgjigje, duke merituar vendin e parë në këtë konkurs. Ky konkurs tregoi edhe një herë rëndësinë e veprimtarive të tilla në shkollë, të cilat ndihmojnë në zhvillimin e njohurive, aftësive dhe interesit të nxënësve për shkencën. Ky konkurs u prit me shumë entuziazëm nga të gjithë pjesëmarrësit dhe do te mbetet një përvojë e bukur për nxënësit që morën pjesë në të."
  },
  "output": {
    "grammar": {
      "verdict": "partial",
      "issues": []
    },
    "writing_style": {
      "verdict": "partial",
      "issues": [],
      "detected_register": "informational",
      "expected_register": "unspecified"
    },
    "formatting": {
      "verdict": "pass",
      "issues": []
    },
    "brand_compliance": {
      "score": 50,
      "verdict": "partial",
      "issues": []
    },
    "marketing_compliance": {
      "score": 50,
      "verdict": "partial",
      "issues": []
    },
    "structure": {
      "verdict": "no_brief_provided",
      "key_points_coverage": [],
      "structure_type_detected": "unclear",
      "guidance": "No brief was provided, so structure assessment should focus on coherence and flow."
    }
  }
}
