{
  "id": "alb-editorial-0008",
  "metadata": {
    "register": "editorial",
    "annotator": "human",
    "rlhf_eligible": true,
    "version": "1.0.0",
    "reviewer": "",
    "reviewed_at": ""
  },
  "input": {
    "brand_guidelines": "",
    "key_points": [],
    "article_text": "Sokratizmi në epokën e algoritmeve: Rëndësia e pyetjes së duhur në kërkimin e së vërtetës Në një epokë të dominuar nga algoritmet, inteligjenca artificiale dhe vendimmarrja e bazuar në të dhëna, praktika e lashtë filozofike e sokratizmit, e rrënjosur në artin e të pyeturit, mbetet thellësisht e rëndësishme. Sokrati, filozofi klasik grek, pohonte se mençuria fillon me njohjen e padijes së vet dhe me shqyrtimin e pandërprerë të supozimeve përmes pyetjeve kritike. Kërkimi i së vërtetës nuk varet thjesht nga qasja në sasi të mëdha informacioni apo nga fuqia llogaritëse, por nga aftësia për të bërë pyetjet e duhura. Pa këtë aftësi themelore, njohuritë që gjenerohen nga algoritmet rrezikojnë të jenë sipërfaqësore ose çorientuese, duke dobësuar kuptimin e vërtetë. Në thelb, sokratizmi thekson hetimin dialektik: një metodë dialogu që zbulon kundërthënie dhe rafinon konceptet përmes pyetjeve të vazhdueshme. Kjo metodë kultivon përulësinë intelektuale dhe një kuptim më të thellë të ideve komplekse. Në kontrast, algoritmet funksionojnë mbi parametra të paracaktuar dhe të dhëna hyrëse, duke e përpunuar informacionin në mënyrë mekanike dhe efikase. Ndërsa algoritmet janë të shkëlqyera në njohjen e modeleve dhe optimizimin, atyre u mungon gjykimi i brendshëm për të vendosur se cilat pyetje duhen bërë apo cilat probleme duhet të kenë përparësi. Prandaj, roli njerëzor në formulimin e pyetjeve mbetet i pazëvendësueshëm. Praktikisht, algoritmet veprojnë brenda kufizimeve të programimit të tyre dhe cilësisë së të dhënave. Ato nuk mund të zbulojnë në mënyrë autonome paragjykime, dilema apo nuanca kontekstuale pa udhëzimin njerëzor. Formulimi i pyetjeve përcakton se çfarë të dhënash mblidhen, si interpretohen ato dhe çfarë përfundimesh nxirren. Në fusha si mjekësia apo politikat sociale, të bërit pyetjen e duhur mund të nënkuptojë dallimin mes drejtësisë dhe padrejtësisë, shërimit dhe dëmit. Sokratizmi mëson se e vërteta nuk merret pasivisht, por ndërtohet në mënyrë aktive përmes dialogut dhe hetimit — një proces që algoritmet, të vetme, nuk mund ta riprodhojnë. Pyetjet krijojnë horizontin e dijes. Një pyetje e formuluar keq mund ta kufizojë kërkimin në fusha të parëndësishme, ndërsa një pyetje e ndërtuar mirë hap rrugë drejt njohurive të thella. Për shembull, të pyesësh “Çfarë të dhënash kemi?” ndryshon thelbësisht nga “Çfarë kuptimi kanë këto të dhëna në kontekstin e vlerave njerëzore?”. E para fton thjesht grumbullimin e informacionit, kurse e dyta është ajo që kërkon reflektim interpretues, që është thelbi i hetimit sokratik. Për më tepër, epoka e algoritmeve rrezikon të nxisë një lloj rehatie të dëmshme. Marrja e përgjigjeve të menjëhershme mund t’i joshë individët t’i pranojnë rezultatet pa i vënë në dyshim, duke neglizhuar parimet sokratike për të pyetur vazhdimisht. Kjo rehati mund të çojë në dobësimin e aftësive të të menduarit kritik dhe në një kapacitet të reduktuar për të dalluar të vërtetën nga gënjeshtrat. Sokratizmi i kundërvihet kësaj prirjeje duke këmbëngulur se çdo përgjigje duhet të pasohet nga pyetje të tjera, duke siguruar që kuptimi të mbetet dinamik dhe vetë-korrigjues. Marrëdhënia mes sokratizmit dhe algoritmeve nuk është armiqësore, por plotësuese. Algoritmet mund të përpunojnë dhe analizojnë të dhëna në përmasa të paimagjinueshme për njerëzit, por përzgjedhja e pyetjeve të përshtatshme dhe interpretimi i rezultateve kërkojnë mençuri njerëzore. Pyetja sokratike ofron një kornizë për të shqyrtuar në mënyrë kritike rezultatet e algoritmeve, për të sfiduar kufizimet e tyre dhe për t’i vendosur gjetjet e tyre brenda kuadrit të vlerave njerëzore dhe filozofike. Në përfundim, kërkimi i së vërtetës në epokën e algoritmeve kërkon një rigjallërim të pyetjes sokratike. Fuqia e algoritmeve qëndron në aftësinë e tyre llogaritëse, por zbatimi i tyre kuptimplotë varet nga aftësia njerëzore për të bërë pyetje të mprehta dhe reflektuese. Ky bashkëveprim mes kërkimit njerëzor dhe përpunimit mekanik mban premtimin për dije më të thellë dhe vendimmarrje më të mençur. Pa pyetjet e duhura, peizazhi i gjerë informativ që përshkohet nga algoritmet mbetet pa drejtim; me sokratizmin si udhërrëfyes, ai shndërrohet në një udhëtim me qëllim drejt së vërtetës."
  },
  "output": {
    "grammar": {
      "verdict": "partial",
      "issues": []
    },
    "writing_style": {
      "verdict": "partial",
      "issues": [],
      "detected_register": "editorial",
      "expected_register": "unspecified"
    },
    "formatting": {
      "verdict": "pass",
      "issues": []
    },
    "brand_compliance": {
      "score": 50,
      "verdict": "partial",
      "issues": []
    },
    "marketing_compliance": {
      "score": 50,
      "verdict": "partial",
      "issues": []
    },
    "structure": {
      "verdict": "no_brief_provided",
      "key_points_coverage": [],
      "structure_type_detected": "unclear",
      "guidance": "No brief was provided, so structure assessment should focus on coherence and flow."
    }
  }
}
