{
  "id": "alb-classical-0065",
  "metadata": {
    "register": "classical",
    "annotator": "human",
    "rlhf_eligible": true,
    "version": "1.0.0",
    "reviewer": "",
    "reviewed_at": ""
  },
  "input": {
    "brand_guidelines": "",
    "key_points": [],
    "article_text": "The starred message If I know that what I said made you smile tonight, I'm going to star your message so I never forget how. When the time passes by and I won’t be able to text you, I’ll go and see the starry sky with moments like this one. I'll read through messages of the past and wish that I could text you still. I’ll see that you are online and dream you’d remember me. But I do not believe my dreams will ever come true, for the stars I seek are bright and stable and not coming down to me. If I feel worthless and alone, if tears prick my eyes, God, remind me that I stand under all these stars. And I might want to reach them and go back to this time where I can casually say hi and you’d give out a smile. And I am sorry, but it is true that I don’t believe in myself. But I shall keep my promise and remember what you said. I’ll remember to breathe, even if I feel like an ocean is over my head, and I’ll remember all the advice you gave so casually in the end. I’m sorry that I can’t tell you more than I already have. I’m sorry that these words by you will never be read."
  },
  "output": {
    "grammar": {
      "verdict": "partial",
      "issues": []
    },
    "writing_style": {
      "verdict": "partial",
      "issues": [],
      "detected_register": "classical",
      "expected_register": "unspecified"
    },
    "formatting": {
      "verdict": "pass",
      "issues": []
    },
    "brand_compliance": {
      "score": 50,
      "verdict": "partial",
      "issues": []
    },
    "marketing_compliance": {
      "score": 50,
      "verdict": "partial",
      "issues": []
    },
    "structure": {
      "verdict": "no_brief_provided",
      "key_points_coverage": [],
      "structure_type_detected": "unclear",
      "guidance": "No brief was provided, so structure assessment should focus on coherence and flow."
    }
  }
}
