{
  "id": "alb-informational-0042",
  "metadata": {
    "register": "informational",
    "annotator": "human",
    "rlhf_eligible": true,
    "version": "1.0.0",
    "reviewer": "",
    "reviewed_at": ""
  },
  "input": {
    "brand_guidelines": "",
    "key_points": [],
    "article_text": "Nxënësit e Muajit Ilari Muja (Viti i 2-të, Gjimnaz i përgjithshëm) Ilari Muja shquhet si një nxënëse e jashtëzakonshme në shkencat natyrore, duke demonstruar vazhdimisht si aftësi të forta akademike ashtu edhe kuriozitet për të mësuar më shumë. Përtej arritjeve të saj në klasë, ajo njihet për personalitetin e saj miqësor dhe të afrueshëm, duke e bërë atë një prani pozitive midis bashkëmoshatarëve të saj. Endri Egra (Viti i 3-të, Elektronikë) Endri Egra vazhdon të bëjë përshtypje me arritjet e tij të jashtëzakonshme në shkencë, veçanërisht si fitues i Olimpiadës Kombëtare të Fizikës. Përkushtimi dhe pasioni i tij për të mësuar janë të dukshme ndërsa ai vazhdontë shkëlqejë edhe më shumë në fushën shkencore, duke dhënë një shembull frymëzues për të tjerët. Vanesa Daci (Viti i 2-të, Elektronikë) Vanesa Daci është dalluar për aftësitë të saj të forta në programim dhe inovacion. Si fituese e TeensIn Innovation Hub, ajo ka provuar aftësinë e saj për të menduar në mënyrë krijuese dhe për të aplikuar njohuritë e saj në mënyra praktike, duke e bërë atë një talent premtues në botën e teknologjisë. Ergi Keri (Viti i 3-të, Automekanikë) Ergi Keri njihet për inteligjencën dhe aftësitë e tij praktike në zgjidhjen e problemeve. Përkushtimi i tij ndaj të nxënit dhe qasja e tij e menduar mirë ndaj sfidave e bëjnë atë një student të shquar në fushën e tij, me potencial të madh për sukses në të ardhmen në degë si mekatronika. Kristo Greku (Viti i 3-të, Biznes) Kristo Greku ka treguar përkushtim të fortë ndaj studimeve të tij në biznes, duke kombinuar të menduarit analitik me një kuptim të mprehtë të koncepteve të botës reale. Motivimi dhe përpjekja e tij e vazhdueshme nxjerrin në pah potencialin e tij si një profesionist i ardhshëm në fushën e biznesit dhe financës. Ivana Deti (Viti i 2-të, Gjimnaz i përgjithshëm) Ivana Deti shkëlqen në shkencat natyrore, veçanërisht në biologji, ku ajo ka demonstruar si talent ashtu edhe entuziazëm. Performanca e saj akademike dhe interesi i vërtetë për lëndën e bëjnë atë një studente premtuese me një të ardhme të ndritur përpara. Henri Marku (Viti i 2-të, Gjimnaz i përgjithshëm) Henri Marku është një student i shkëlqyer i njohur për performancën e tij të fortë akademike dhe pjesëmarrjen aktive në ekipin e debatit të shkollës. Aftësia e tij për të menduar në mënyrë kritike dhe për të shprehur ide e dallon qartë atë si brenda ashtu edhe jashtë klasës. Rrona Kaba (Viti i 2-të, Gjimnaz i përgjithshëm) Rrona Kaba kombinon përsosmërinë akademike në shkenca me një përfshirje aktive në sport. Natyra e saj miqësore dhe qasja e ekuilibruar ndaj jetës shkollore e bëjnë atë një nxënëse të gjithanshme që kontribuon pozitivisht në komunitetin e shkollës."
  },
  "output": {
    "grammar": {
      "verdict": "partial",
      "issues": []
    },
    "writing_style": {
      "verdict": "partial",
      "issues": [],
      "detected_register": "informational",
      "expected_register": "unspecified"
    },
    "formatting": {
      "verdict": "pass",
      "issues": []
    },
    "brand_compliance": {
      "score": 50,
      "verdict": "partial",
      "issues": []
    },
    "marketing_compliance": {
      "score": 50,
      "verdict": "partial",
      "issues": []
    },
    "structure": {
      "verdict": "no_brief_provided",
      "key_points_coverage": [],
      "structure_type_detected": "unclear",
      "guidance": "No brief was provided, so structure assessment should focus on coherence and flow."
    }
  }
}
