{
  "id": "alb-editorial-0011",
  "metadata": {
    "register": "editorial",
    "annotator": "human",
    "rlhf_eligible": true,
    "version": "1.0.0",
    "reviewer": "",
    "reviewed_at": ""
  },
  "input": {
    "brand_guidelines": "",
    "key_points": [],
    "article_text": "Rrjetëzimi (Networking): Si të kthesh një bisedë në mundësi biznesi. Në botën e biznesit, shpesh thuhet se “ideja është e rëndësishme, por rrjeti i kontakteve është vendimtar”. Shumë të rinj mendojnë se lidhjet me investitorë krijohen vetëm pas universitetit apo kur biznesi është tashmë i konsoliduar. Në fakt, rrugëtimi mund të nisë shumë më herët.që në bankat e shkollës. Si nxënëse e degës së biznesit, kam kuptuar se rrjetëzimi nuk është thjesht shkëmbim kartëvizitash. Ai është ndërtim marrëdhëniesh, komunikim i qartë i ideve dhe krijim besimi. Shkolla jonë, përmes praktikës dhe projekteve, na jep mundësinë të hedhim hapat e parë drejt këtij procesi. Çfarë është rrjetëzimi dhe pse është i rëndësishëm? Rrjetëzimi (networking) është procesi i krijimit dhe zhvillimit të marrëdhënieve profesionale që mund të kontribuojnë në rritjen personale dhe në zhvillimin e një biznesi. Për një startup, kontaktet janë po aq të rëndësishme sa kapitali fillestar. Një ide e mirë ka nevojë për: • këshillim profesional, • mbështetje financiare, • orientim strategjik, • promovim dhe besueshmëri. Të gjitha këto mund të vijnë përmes rrjetit të duhur të kontakteve. Si fillon rrjetëzimi që në shkollë? Shumë mund të mendojnë se nxënësit nuk kanë akses tek investitorët. Por në realitet, mundësitë janë më të afërta se sa duken. 1. Pjesëmarrja në veprimtaritë dhe panaire shkollore Prezantimet e projekteve, konkurset e biznesit apo panairet janë momente ideale për të treguar idenë përpara mësuesve, prindërve, bizneseve lokale apo të ftuarve specialë. 2. Praktika profesionale Gjatë praktikës, ne kemi mundësi të takojmë sipërmarrës, menaxherë apo profesionistë të fushës. Një komunikim i mirë, serioziteti dhe përgatitja mund të lënë një përshtypje që hap dyer në të ardhmen. 3. Rrjetet sociale profesionale Krijimi i një profili serioz në platforma profesionale dhe ndarja e projekteve tona tregon seriozitet dhe pasion. Edhe një postim i strukturuar mirë për një ide biznesi mund të tërheqë vëmendjen e duhur. 4. Komunikimi i qartë i idesë (Elevator Pitch) Pothuajse në çdo lënde kemi mësuar të prezantojmë idetë tona në mënyrë të përmbledhur dhe bindëse. Një prezantim 1–2 minutësh që shpjegon problemin, zgjidhjen dhe potencialin e tregut është një aftësi thelbësore kur takon dikë që mund të bëhet investitor. Çfarë kërkojnë investitorët? Investitorët nuk kërkojnë vetëm ide të mira. Ata kërkojnë: • seriozitet dhe përgatitje, • plan të qartë biznesi, • kuptim të tregut, • pasion dhe përkushtim, • aftësi për të pranuar këshilla dhe për të përmirësuar idenë. Në këtë pikë, formimi që marrim në shkollë bëhet një përparësi e madhe. Njohuritë mbi planin e biznesit, analizën financiare dhe marketingun na bëjnë më të sigurt dhe më profesionalë në komunikim. Sfidat e para Sigurisht, rrjetëzimi nuk është i lehtë. Ka pasiguri, ndonjëherë refuzim, apo mungesë përgjigjeje. Por çdo takim është një përvojë mësimi. Çdo prezantim na ndihmon të përmirësojmë mënyrën si shprehim idenë tonë. Shpesh, investimi i parë që marrim nuk është financiar,është një këshillë e vlefshme, një kontakt i ri apo një sugjerim për përmirësim. Këto janë po aq të rëndësishme sa kapitali. Rrjetëzimi si investim në veten tonë Në fund, rrjetëzimi nuk ka të bëjë vetëm me gjetjen e investitorëve. Ka të bëjë me ndërtimin e identitetit tonë profesional që në moshë të re. Ai na mëson të komunikojmë me siguri, të prezantojmë idetë tona me argumente dhe të ndërtojmë marrëdhënie të bazuara në respekt dhe besim. Nëse sipërmarrja fillon me një ide, atëherë suksesi fillon me njerëzit e duhur. Dhe krijimi i këtyre kontakteve mund të nisë që sot – nga bankat e shkollës. Sepse e ardhmja e biznesit nuk ndërtohet vetëm me kapital, por me guxim për të trokitur në derën e parë."
  },
  "output": {
    "grammar": {
      "verdict": "partial",
      "issues": []
    },
    "writing_style": {
      "verdict": "partial",
      "issues": [],
      "detected_register": "editorial",
      "expected_register": "unspecified"
    },
    "formatting": {
      "verdict": "pass",
      "issues": []
    },
    "brand_compliance": {
      "score": 50,
      "verdict": "partial",
      "issues": []
    },
    "marketing_compliance": {
      "score": 50,
      "verdict": "partial",
      "issues": []
    },
    "structure": {
      "verdict": "no_brief_provided",
      "key_points_coverage": [],
      "structure_type_detected": "unclear",
      "guidance": "No brief was provided, so structure assessment should focus on coherence and flow."
    }
  }
}
